feedback,sentiment,nps,service_advisor_name,brand_name,branch,date,promoters,passive,detractor,category,topic
"It was very bad and disappointed, as we brought the car without any issues, and handed in with multiple issues, vibration, rpm, check engine, and gear shifting sound as well and the car just 20,000km mileage",negative,0,Nikhil Dinesh Karnad,,,2023-04-05,0,0,1,,
Very fast service,negative,10,Faisal AliAhmed,,,2023-04-06,1,0,0,,
"The express service took 3 hours, the wash was the worst as it wasn’t done properly and left swirl marks on the body ",negative,5,Harish V.,,,2023-04-06,0,0,1,,
"I am happy with Nissan Airport Road. From booking to getting back my car, I had a pleasant experience. Ms. Marla is always helping me find the best solution whenever I have issues with my car and giving me advice. She also informs me whenever there are on-going promotions. This is the reason why I keep coming back for 9 years now. Thank you.",positive,10,Marla Nunez,,,2023-04-07,1,0,0,,
"Everything was perfect, Mr Marshood my service advisor was of so much help and guidance to me. But i would request for the car cleaning to be done in a more professional manner since the car is at the nissan agency itself. Some areas in the car were not cleaned. It would be nice to receive the car from nissan service center in it’s best condition. ",positive,8,Marshood TP,,,2023-04-07,0,1,0,,
Thanks for our agent for giving us discount.,positive,9,Janidu Harindra,,,2023-04-07,1,0,0,,
"Please check correctly because after receiving the car on the same day of delivery, it stopped working. Please take care of the check carefully",negative,4,Mohamed Mohsen,,,2023-04-07,0,0,1,,
Service package price is always high.,positive,7,Abuthahir T.S.,,,2023-04-08,0,1,0,,
Service advisor communication was not clarified and it leads to the arguments at the vehicle delivery time. His behaviour was aggressive with us.,negative,5,Mohammad Draij,,,2023-04-08,0,0,1,,
The customer gets the earliest date to maintain his car,negative,10,Abuthahir T.S.,,,2023-04-08,1,0,0,,
High prices for regular vehicle maintenance,negative,10,Avtik Raje,,,2023-04-08,1,0,0,,
"If you make a free service for my car, I would thank you because the agency asked me to pay 3 checks worth 2900 dirhams. Please help me and drop the amount. Thank you",negative,10,Adnan Aslam,,,2023-04-08,1,0,0,,
Thank you very much,positive,10,Ali Musa,,,2023-04-10,1,0,0,,
Thank you for always taking care of us!!,positive,10,Avtik Raje,,,2023-04-10,1,0,0,,
Thanks for mohamed osman he is the best,positive,10,Mohammed Osman,,,2023-04-10,1,0,0,,
Service advisor Aries is very helpful as well as the ladies from the reception.. keep the excellent customer service,positive,10,Aries M.,,,2023-04-10,1,0,0,,
The Service Agent was very helpful. Salwa Rboub in particular.,positive,10,Salwa Rboub,,,2023-04-10,1,0,0,,
Rest was not done and it’s till showing servise due change engine oil and all,negative,0,Mohammad Draij,,,2023-04-10,0,0,1,,
None thanks,negative,10,Khalil Rahman,,,2023-04-10,1,0,0,,
Excellent. He was very helpful in supporting me and updating me every step of the way. Very pleased with my car service.,positive,10,Parag Laxmayyan,,,2023-04-11,1,0,0,,
Thank you Marla for your excellent support.,positive,10,Marla Nunez,,,2023-04-11,1,0,0,,
"All good, thank you!",positive,10,Salwa Rboub,,,2023-04-11,1,0,0,,
"The maintenance was not recorded in the maintenance book, nor did I get the details of what was done, but in general the service was good and fast",positive,8,Mahmoud Wahhab,,,2023-04-11,0,1,0,,
Thanks for the service,positive,9,Suha Ali,,,2023-04-11,1,0,0,,
Thank you for good service for Nissan Service,positive,9,Faisal AliAhmed,,,2023-04-11,1,0,0,,
Great quality of service provided by my Service Advisor - Md Sekander. He gave me the best alternative options to consider.,positive,10,Md Sekander,,,2023-04-11,1,0,0,,
The personal transfer service is one of Al Masaood Car services free of charge.,positive,10,Adnan Aslam,,,2023-04-11,1,0,0,,
"Your team don't the work as required. 
",negative,1,Mahmoud Wahhab,,,2023-04-11,0,0,1,,
There is no,positive,10,Adnan Aslam,,,2023-04-12,1,0,0,,
Appreciated,positive,9,Vivian Rodricks,,,2023-04-12,1,0,0,,
It should be a special rate for persons like whom abu dhabi government employee or,positive,10,Aries M.,,,2023-04-12,1,0,0,,
Poor service,negative,0,Mohammad Draij,,,2023-04-12,0,0,1,,
Online appointment booking system needs improvement. Submitted online request 3 times but didn't get any response.,negative,9,Anandhakrishnan,,,2023-04-12,1,0,0,,
"1. Please provide free car drop facility after dropping customer car.
2. Car was never washed externally or internally - Include car wash for every service ",negative,7,Nabeel A.,,,2023-04-12,0,1,0,,
Outstanding service specifically when you know that Khalil is on duty and taking care of everything,positive,10,Khalil Rahman,,,2023-04-13,1,0,0,,
Thanks to Ahmed Albolooshi,positive,10,Mohammad Draij,,,2023-04-13,1,0,0,,
The problem with sealers they make a quick procedures once you want to take a car so far so good ‘ But when we need a help or some one to take care about our opinion we will suffering when the car will take 4 to 7 day’s work,positive,3,Mohammed Osman,,,2023-04-13,0,0,1,,
"The camel problem has not been solved 
And the air conditioner still does not give cold ",negative,1,Ali Musa,,,2023-04-13,0,0,1,,
Excellent work by Vivian and his team.keep it up,positive,10,Vivian Rodricks,,,2023-04-14,1,0,0,,
Activate the car charging service from home,positive,10,Adnan Aslam,,,2023-04-14,1,0,0,,
"To be more organized , customer friendly , respect customer time ",positive,3,Mahmoud Wahhab,,,2023-04-14,0,0,1,,
Thank you Adnan. You are always the best,positive,10,dnan Aslam,,,2023-04-15,1,0,0,,
Keep up the good work and relation with your customers,positive,10,Marshood TP,,,2023-04-15,1,0,0,,
Excellent services .,positive,10,Avtik Raje,,,2023-04-15,1,0,0,,
Improve service scheduling experience,positive,10,Avtik Raje,,,2023-04-15,1,0,0,,
Alot of things,positive,2,Nabeel A.,,,2023-04-15,0,0,1,,
"The water reservoir for wipers was well functioning before the service. After service, they have mentioned it as leaking and given quotation of big amount",negative,6,Kamal Al Saber,,,2023-04-15,0,0,1,,
Car was just cleaned from outside only. Engine bay was so dirty.,negative,8,Aswad Karim,,,2023-04-15,0,1,0,,
"Everything on the service was okay except the cleaning service (car wash) it’s not clean as the same before. 
",negative,8,Marla Nunez,,,2023-04-15,0,1,0,,
"I found after service, there is a three dot of yellow color on LH side near to the aft tire. They try to removed it and found a minor scratch after they did something and the paint protection was removed on that area and the yellow dot remains. Ms Marla take actions to send my car in musaffah service center after ramadan. Hopefully my car paint will restore in no time. 
 ",negative,9,Marla Nunez,,,2023-04-15,1,0,0,,
"Unfortunately it was the warst service ever , I wait for 2 hours and the car was not clean well and very dirty and the paper was added on the dirts even for the check it’s not checked. It was the first time visit and I think I will never advise any. I deal with Mercedes and Lexus and both are totally different than what I facing with and Iam really wish that not bought from you very low service.",negative,0,Charbel Semaan,,,2023-04-15,0,0,1,,
My car was not properly cleaned this time.. prices are too high for service and no benefits are provided to loyal customers who are with you from last 5 6 years,negative,6,Nabeel A.,,,2023-04-15,0,0,1,,
Service was good and my thank to Mr. Sekander who handle my request in right way .,positive,10,Md Sekander,,,2023-04-17,1,0,0,,
"Meeting my requirements and examining flaws. The team is progressing. I hope they will improve and progress more and more. Thank you very much 

Please make discounts for maintenance and services. It is necessary because we deserve and pay high amounts since the purchase ",positive,10,Parag Laxmayyan,,,2023-04-17,1,0,0,,
Accuracy in working in a manner that suits the customer,positive,9,Adnan Aslam,,,2023-04-17,1,0,0,,
There is no,positive,3,Mohammad Draij,,,2023-04-17,0,0,1,,
Thanks for Hospitality and your service,positive,10,Anandhakrishnan,,,2023-04-17,1,0,0,,
Nice service,positive,10,Aswad Karim,,,2023-04-17,1,0,0,,
There is brocken knob in my cars manual break after service I can provide you the pictures,negative,5,Nabeel A.,,,2023-04-17,0,0,1,,
I was supposed to change Tyres this service. It was strange that no Tyres were available!!,negative,8,Marla Nunez,,,2023-04-17,0,1,0,,
Thank you very much,positive,10,Anandhakrishnan,,,2023-04-18,1,0,0,,
Good supervive specially from Mr. Younes,positive,10,Mohamed Awad,,,2023-04-18,1,0,0,,
Thanks to kareem.from al ain maintenance...its been 10.years with him and hope to.continue,positive,10,Aswad Karim,,,2023-04-18,1,0,0,,
Good service,positive,9,Faisal AliAhmed,,,2023-04-18,1,0,0,,
I would like to thank you for the great services provided.,positive,10,Charbel Semaan,,,2023-04-18,1,0,0,,
Best possible discount or offer,positive,8,Charbel Semaan,,,2023-04-18,0,1,0,,
The service rates are very high. Revised rates to be considered.,positive,7,Harish V.,,,2023-04-18,0,1,0,,
It was noticed and shouted at the doors by you,negative,8,Mohamed Awad,,,2023-04-18,0,1,0,,
The settings have changed so that RBM has been modified to a radio screen. I didn't understand that,negative,5,Nabeel A.,,,2023-04-18,0,0,1,,
"There are faults in the vehicle and there is no crew or team that can solve the problems, which leads to removing the vehicle from the maintenance center and going to an external workshop to perform the necessary maintenance 

There is no experienced staff that is worthy of the name (Al Masaood Motors)

The decision maker is requested to take into account the appointment decision for the technical staff to repair vehicles ",negative,0,Mohd Noureldin,,,2023-04-18,0,0,1,,
Service charges are high. Please consider to reduce.,negative,5,Avtik Raje,,,2023-04-18,0,0,1,,
"First of all, improve your service team and your team. Then come ask people, the worst car I've ever bought in my life every day is ruined in the car, a loss of 315 thousand 👎🏻",negative,0,Aswad Karim,,,2023-04-18,0,0,1,,
"Send a text message about the end of maintenance 
Adjusting the prices of maintenance packages so that they are accessible to all 
Completion of maintenance in the least possible period 
Thank you to the maintenance officer Mohamed Osman for the good reception, the courtesy in dealing and the permanent smile 
Thank you to the customer service officer. Congratulations from the call center for taking care of the maintenance issue and for contacting me until the problem is solved 
I am honored and proud to be a customer of Al Masaood Cars",positive,10,Mohammed Osman,,,2023-04-19,1,0,0,,
I was happy to deal with Brother Kamal and Brother Hani in the maintenance department.. A helpful team but my only comment is on the workshop driver.,positive,8,Hany Sobhy,,,2023-04-19,0,1,0,,
"Care should be taken to ensure the accuracy of transparency and the accuracy of quality 
You should change the style of furniture for customer service offices and make sure that they have a beautiful space and colors, not as it is now. It is dark. I want to change the style of furniture for customer service offices. Why are there air conditioners ",positive,10,Harish V.,,,2023-04-19,1,0,0,,
"Yes, it is true that in 2013, 2014 and 2015 it was the service. Al Masaood feels that it is their car, not your car. They take it back and there is no sound or anything and they clean it more than the day it will be displayed in the showroom
But I feel that in recent years the job is only for the break brick filter, but there is no comprehensive examination even for the car interior 
I hope the previous work spirit returns to this great establishment",negative,7,Charbel Semaan,,,2023-04-19,0,1,0,,
I want also to thanks the service advisor,negative,10,Abuthahir T.S.,,,2023-04-19,1,0,0,,
So far no negative comments as the service team starting from the receptionist to the recovery team who handled the services were very accommodating and timely. No hassle at all. Well done,positive,10,Vivian Rodricks,,,2023-04-24,1,0,0,,
"I hope to make discounts on maintenance packages 
Thank you ",positive,10,Adnan Aslam,,,2023-04-24,1,0,0,,
May God reward you,negative,8,Harish V.,,,2023-04-24,0,1,0,,
Very courteous and explain well what they did to my car,negative,10,Anandhakrishnan,,,2023-04-24,1,0,0,,
"I am glad that nowadays for my service,evryhing that I informed that has an issue was addressed and fixed immediately. The advisor Jun Kalisag so far is one of the best advisor in Nissan who made sure all complaints feom his client has been addressed and he made sure we will go home happy as the car is working fine as expected.

Thank you to Jun Kalisag and the mechanic team for a job well done! Keep it Up!

Happy client here. 😉",positive,10,Juan Kasilag,,,2023-04-25,1,0,0,,
Excellent service advisor and service thanks,positive,10,Salwa Rboub,,,2023-04-25,1,0,0,,
Providing customer delivery service,positive,9,Mohammed Osman,,,2023-04-25,1,0,0,,
Great job keep it up.,positive,10,Janidu Harindra,,,2023-04-25,1,0,0,,
Providing home service,positive,10,Marla Nunez,,,2023-04-25,1,0,0,,
Abdul karim is a big help,positive,10,Aswad Karim,,,2023-04-25,1,0,0,,
Improve communication with the customer from the beginning of the service to receiving the car,positive,2,Md Sekander,,,2023-04-25,0,0,1,,
"my car is new, i bought is on April 2019, it only went for 29000 km until now. I'm taking very good care of it, it's slightly used. Yet, a couple of days ago the AC suddenly stopped working, I refilled gas and the next day it stopped working again. I took it for service, and after check up I was told that there's a small hole in the heating unit in one of it's pipes, and that the whole unit will need replacement! and it will cost 10000 dhs! shouldn't this happen way later like years later, considering it's a new car with very light use and considering the high expectations working woth Al Masaood company??
I'm very very disappointed honestly, I regret dealing with Al Masaood
shouldn't the warranty for the AC in a new car like this be covered for 5 years?
I can't believe this level of unsatisfaction can be given by Al Masaood company. I thought I'll kerp getting service from them for a long time, but this unfriendly untrusted way of dealing with customers ended it for me. ",negative,0,Nabeel A.,,,2023-04-25,0,0,1,,
Would be better if I get details of the service done like oil change filters tyre rotation and the expected dat of the next service.,negative,10,Khalil Rahman,,,2023-04-25,1,0,0,,
Cleaning was poor. Some oil was splashed in the side glasses. Tyre pressure was not checked and I had to bring the car back to service center for corrections. I waited for 1 hour for my car delivery.,negative,5,Mohamed Awad,,,2023-04-25,0,0,1,,
Repair was done upon release but the problem still existed before reaching my home. I informed the center & told me to send the car back.,negative,7,Kamal Al Saber,,,2023-04-25,0,1,0,,
"Hire more professional and qualified people from the receptionist to the technicians. There is no value for money in anything they provide.
There are not honest ",negative,0,Muhammad Habib,,,2023-04-25,0,0,1,,
Very slow and bad service and was very late to finish the 1000km service,negative,0,Mohamed Awad,,,2023-04-25,0,0,1,,
"Thank you Marla, she is prompt, calls back, know what she is doing and mindful of customers. Such a smooth experience I had. Thank you again.

Mohamed Saleh",positive,10,Marla Nunez,,,2023-04-26,1,0,0,,
I suggest continuing to provide offers and complementary services such as shipping the vehicle from home to maintenance and returning it. This proposal brings customers and makes them feel comfortable and excellent service,positive,10,Juan Kasilag,,,2023-04-26,1,0,0,,
Charbel always exceeds my expectations with his professionalism and eagerness to help. He is reachable 24/7 providing advise even during his personal time. I feel relaxed when the car is delivered to him as I know for sure that he will do his best.,positive,10,Charbel Semaan,,,2023-04-26,1,0,0,,
There is no,positive,10,Salwa Rboub,,,2023-04-26,1,0,0,,
Thanks for the great work,positive,10,Nabeel A.,,,2023-04-26,1,0,0,,
"You need to focus on the drivers who gives the car back to the customers, they take a lot of time to hand you the keys.. this is the only concern.",positive,10,Mohamed Awad,,,2023-04-26,1,0,0,,
The car wash and cleaning can be done better. It looked like car was just wiped with cloth,negative,9,Kamal Al Saber,,,2023-04-26,1,0,0,,
Time management — it takes at least two hour to register and release (combined) the vehicle during the service visit,negative,4,Khalil Rahman,,,2023-04-26,0,0,1,,
"Terrible, will try not to use them again. ",negative,0,Marla Nunez,,,2023-04-26,0,0,1,,
Mr. Adnan is an excellent customer service representative.,positive,10,Adnan Aslam,,,2023-04-27,1,0,0,,
"Nabeel, the service advisor was really nice.",positive,10,Nabeel A.,,,2023-04-27,1,0,0,,
You can possibly get a work study done on all periodic services and accordingly advice the customer how long will it take for a such services,positive,8,Nikhil Dinesh Karnad,,,2023-04-27,0,1,0,,
Worst service in my life,negative,0,Mohammed Osman,,,2023-04-27,0,0,1,,
"Please improve your after sales service. After buying new car, it was my first car service experience which was not at all satisfactory and upto the brand value.",negative,2,Khalil Rahman,,,2023-04-27,0,0,1,,
"Please reduce maintenance prices because they are very high 

An increase in prices and there is no justification for this ",negative,9,Aries M.,,,2023-04-27,1,0,0,,
Thanks Janidu specialist .I will come again,positive,10,Janidu Harindra,,,2023-04-28,1,0,0,,
Thank you Mohamed for your hardworking explaining everything,positive,8,Harish V.,,,2023-04-28,0,1,0,,
"To have honest and sincere men who know what safety is 
At work 
I wish you success in sha Allah 😁
",positive,10,Salwa Rboub,,,2023-04-28,1,0,0,,
Your manager at the branch should care more about the customers and return their calls and request to discuss issues with him,negative,2,Khalil Rahman,,,2023-04-28,0,0,1,,
"I have a damaged driver's fabric and before it was in trouble and it was repaired, but the chair fabric is not changed ",negative,10,Abuthahir T.S.,,,2023-04-28,1,0,0,,
Before selling a car to check if the steering wheel is put properly.,negative,0,Salwa Rboub,,,2023-04-28,0,0,1,,
"Lower the prices for the Q30 services and spare parts, please. ",negative,10,Khalil Rahman,,,2023-04-28,1,0,0,,
"Please reduce the value of the delivery taxi while the car is in maintenance because the price of 52.5 dirhams per delivery is very, very expensive.
Thankyou ",negative,10,Mohamed Mohsen,,,2023-04-28,1,0,0,,
Very happy!,positive,10,Vivian Rodricks,,,2023-04-29,1,0,0,,
Thank you Soo much Al Masaood,positive,10,Adnan Aslam,,,2023-04-29,1,0,0,,
All great. Thanks,positive,10,Mohamed Mohsen,,,2023-04-29,1,0,0,,
"Best price and clear discounts.
Labor cost was to much for battery replacement.",positive,8,Harish V.,,,2023-04-29,0,1,0,,
Everything is good,positive,10,Adnan Aslam,,,2023-04-29,1,0,0,,
"Good service
",positive,8,Harish V.,,,2023-04-29,0,1,0,,
Speed in completing repairs,positive,7,Aries M.,,,2023-04-29,0,1,0,,
Get us a clear feedback on what repairs or service you people are doing??? Make it transparent,negative,8,Vivian Rodricks,,,2023-04-29,0,1,0,,
Coordination between call center and workshop information regarding prices,negative,0,Nabeel A.,,,2023-04-29,0,0,1,,
The problem nissan team not clear with customer example my car under warranty 5 years or 100000 survice but this not true when u go for service many things not included they cheated u they hideit from u they don't tell u ur rights,negative,5,Charbel Semaan,,,2023-04-29,0,0,1,,
The price is too high,negative,8,Harish V.,,,2023-04-29,0,1,0,,
appointment apps don’t work,negative,10,Marla Nunez,,,2023-04-29,1,0,0,,
"There is no Professionalism in team. When I reported the issue of scratch team blamed me only. Cleaning was done properly even after reporting and showing they were not having any interest to correct it.

My first experience with service team is very bad I would avoid to visits there again. ",negative,1,Anandhakrishnan,,,2023-04-29,0,0,1,,
"Security guy at the gate need to be more polite with the customers, during checkout he asked me for exit paper which was not given to me . I was in my petrol, he asked me to go back to the service personal and bring the exit permission. 
 Rather than asking me to go back ,he should have call adnan and talk to him .
 This was a rude and disrespectful behaviour by security guy . ",negative,8,Adnan Aslam,,,2023-04-29,0,1,0,,
Thanks for the good service,positive,10,Charbel Semaan,,,2023-05-01,1,0,0,,
Ronaldo is the best player everywhere,positive,10,Ronaldo P.,,,2023-05-01,1,0,0,,
The prices are exaggerated,negative,10,Faisal AliAhmed,,,2023-05-01,1,0,0,,
"The prices of maintenance and service are 4 times that are outside the agency 
The cleanliness of the car interior is not satisfactory",negative,6,Marla Nunez,,,2023-05-01,0,0,1,,
Excellent service all round. Mr Charbel from servicing and Mr Jamal - the driver - both excellent. Thank you.,positive,10,Charbel Semaan,,,2023-05-02,1,0,0,,
Very good team. Keep the services as they are.,positive,10,Salwa Rboub,,,2023-05-02,1,0,0,,
"Mr Adnan is a fantastic person, always very helpful and efficient.",positive,10,Adnan Aslam,,,2023-05-02,1,0,0,,
It was an excellent experience. Thanks a lot Mr. Anand.,positive,10,Anandhakrishnan,,,2023-05-02,1,0,0,,
Nothing. Excellent work and service,positive,10,Aswad Karim,,,2023-05-02,1,0,0,,
"Marshood he explained well and nice hospitality provided for me , Appreciate him to continue the same . ",positive,10,Marshood TP,,,2023-05-02,1,0,0,,
"Your service center is working perfectly, but the prices is triple the price of repairs in other garages ! I would recommend to lower the prices a bit, and keep your customers loyal to you. If the prices dropped people will avoid going to other garages and would always use your services and keep their cars in good hands. ",positive,8,Mohammed Osman,,,2023-05-02,0,1,0,,
"Please pay more careful attention to the cleanliness of the car because when I received my new car and in its first maintenance service, it was clean and had fingerprints on the seats in black",negative,1,Aries M.,,,2023-05-02,0,0,1,,
Please reduce the prices of checks and coupons,negative,10,Adnan Aslam,,,2023-05-02,1,0,0,,
"Time commitment, there was a delay in the delivery of the car after the service",negative,3,Nikhil Dinesh Karnad,,,2023-05-02,0,0,1,,
Nothing better can be delivered,negative,9,Aries M.,,,2023-05-02,1,0,0,,
The car was not properly cleaned. Vacuum was not properly done.,negative,5,Mohammed Osman,,,2023-05-02,0,0,1,,
"At least you should give some complementary items while receiving a new car, for me didn't get anything. It's not fare. Thankyou",negative,9,Md Sekander,,,2023-05-02,1,0,0,,
Not a good experience from al masood this time. I will take to independant garage next time. Dropped car off Friday and was delivered Monday. Fault not diagnosed in timely manner. Issue with delivery of car on Monday.,negative,0,Mohamed Awad,,,2023-05-02,0,0,1,,
Thank you for the excellent service and Wali Imam,positive,10,Ali Musa,,,2023-05-03,1,0,0,,
Everything perfect,positive,10,Ronaldo P.,,,2023-05-03,1,0,0,,
I would like to extend my sincere thanks and appreciation to the employee Mohamed El Sayed in Madinat Zayed branch,positive,10,Mohd Noureldin,,,2023-05-03,1,0,0,,
"Customer service advice assigned Mr. Ronaldo has provided excellent service, keeping me informed of all the job done and had timely informed that the car is ready for release ",positive,10,Ronaldo P.,,,2023-05-03,1,0,0,,
I would like to thank the team for perfect service,positive,10,Hany Sobhy,,,2023-05-03,1,0,0,,
Thanks for service,positive,10,Nabeel A.,,,2023-05-03,1,0,0,,
Keep the service team as they are valuable to your company.. especially Mr. Jun Kasilag who did perform his job beyond my expectations.. customer like feels more comfortable when we know that our vehicle is in good hands whenever we are keeping our car to nissan for service.. thanks,positive,10,Juan Kasilag,,,2023-05-03,1,0,0,,
"I applied through the website to book a maintenance appointment and I chose the time and determined my need for a replacement car

When the booking confirmation arrived, it was not according to the time you chose and the car was not available. Please check e-booking

The service advisor, Mr. Adnan, is as usual a top in the sophistication of dealing and the speed of performance. Many thanks and gratitude to him for his efforts
",positive,10,dnan Aslam,,,2023-05-03,1,0,0,,
"Please reduce the prices of checks and coupons 
Thank you ",positive,10,Adnan Aslam,,,2023-05-03,1,0,0,,
Kindly give equal opportunity preference to Infiniti customers as Nissan .,positive,7,Khalil Rahman,,,2023-05-03,0,1,0,,
"Ensure the cleanliness of the car before handing it over to the customer completely... as oil residues were detected on the car seat and a complaint was filed in this regard, in addition to not wrapping the car seats in plastic (Hafiz), knowing whether to deliver the car by recovery",negative,10,Parag Laxmayyan,,,2023-05-03,1,0,0,,
More cooperation,negative,7,Harish V.,,,2023-05-03,0,1,0,,
